{
  "$schema": "https://json-schema.org/draft/2020-12/schema",
  "$id": "https://paco.local/schemas/renderer.schema.json",
  "title": "PACO Renderer Manifest",
  "description": "Schema for a single renderer's renderer.json manifest (paco/renderers/<name>/renderer.json). Validates ONE renderer in isolation — registry-level concerns that span multiple renderer.json files (uid uniqueness across the whole set, confirming a base renderer exists for each file_mode) are NOT expressible here and are deliberately left to the boot-time registry-loading code instead.",
  "type": "object",
  "additionalProperties": false,
  "required": ["name", "description", "uid", "abilities"],
  "properties": {
    "name": {
      "type": "string",
      "minLength": 1,
      "description": "Human-readable renderer name, e.g. \"formatted-document\"."
    },
    "description": {
      "type": "string",
      "minLength": 1,
      "description": "Short, human-readable description of what this renderer does."
    },
    "uid": {
      "type": "string",
      "format": "uuid",
      "description": "Globally unique identifier for this renderer. Uniqueness ACROSS the whole renderer set is a registry-loading concern, not enforceable by this single-document schema."
    },
    "abilities": {
      "type": "object",
      "additionalProperties": false,
      "required": ["selection_type", "file_mode"],
      "properties": {
        "selection_type": {
          "type": "string",
          "enum": ["single", "multi"],
          "description": "Whether this renderer applies to a single-item selection or a multi-item selection. Exact match required against the selection's own derived value — see paco/renderers/matcher.js's gate step."
        },
        "file_mode": {
          "type": "string",
          "enum": ["text", "binary", "any"],
          "description": "Whether this renderer applies to text or binary content, per the existing on-prem text/binary classification (paco/file-handler-detect.js) — or \"any\" to match regardless of that classification. \"any\" is a deliberate waiver, not a default/fallback: it exists for renderers whose subject matter is genuinely both at once (SVG being the first case — real, meaningful text content AND a rasterizable image, not \"we don't know which\" the way ambiguous media is). matcher.js's gate skips the file_mode comparison entirely for \"any\" — only selection_type (and file_type, for specificity) still apply. \"text\"/\"binary\" still require an exact match, same as before."
        },
        "binary_category": {
          "type": "string",
          "enum": ["image", "audio", "video", "other"],
          "description": "Generic binary sub-category this renderer handles (rung-2 / generic-category matching — see matcher.js). Only meaningful when file_mode is \"binary\"; forbidden when file_mode is \"text\" or \"any\" — see the file_mode/binary_category conditional below. \"any\" renderers don't consult binary_category at all (the whole point is not caring what fileMode the selection landed in), so declaring one would be misleading rather than just unused. May coexist with file_type, in which case it is purely informational and plays no role in matching (a renderer with file_type is always a rung-1 match, never additionally offered as a rung-2 match)."
        },
        "file_type": {
          "description": "Specific file type(s) this renderer handles (rung-1 / file-specific matching). Either a single non-empty string (e.g. \"png\", \"md\") or a non-empty array of such strings for a closely-related family (e.g. [\"jpeg\",\"jpg\",\"png\",\"gif\"]). A renderer declaring exactly one string here is treated as more specific than one declaring an array, for preselection purposes — see matcher.js's preselection priority order. Legal under both file_mode \"text\" and \"binary\" — there is no requirement to also declare binary_category alongside it (e.g. a markdown renderer needs only file_mode:\"text\" + file_type:\"md\").",
          "oneOf": [
            {
              "type": "string",
              "minLength": 1
            },
            {
              "type": "array",
              "minItems": 1,
              "items": {
                "type": "string",
                "minLength": 1
              },
              "uniqueItems": false,
              "$comment": "uniqueItems is left false here because JSON Schema's built-in uniqueItems check is exact-string (case-sensitive) and cannot itself enforce a case-INSENSITIVE no-duplicates rule (e.g. rejecting [\"png\",\"PNG\"]). That weaker case-sensitive form alone wasn't requested. A case-insensitive duplicate check is a renderer-loading-time concern (or a custom $comment-only convention authors are trusted to follow), not something this schema enforces."
            }
          ]
        }
      },
      "allOf": [
        {
          "$comment": "binary_category is forbidden except under file_mode \"binary\" — i.e. also forbidden for \"any\", not just \"text\". SVG (text content, but conventionally image-like) used to be cited here as a deliberate, accepted gap this schema wasn't going to bend for — it's exactly what \"any\" was added to solve instead (see thumbnail-svg/renderer.json), so that framing no longer applies; this comment is now just explaining the conditional itself.",
          "if": {
            "not": {
              "properties": { "file_mode": { "const": "binary" } },
              "required": ["file_mode"]
            }
          },
          "then": {
            "properties": { "binary_category": false }
          }
        }
      ]
    }
  }
}
