{
  "name": "Thumbnail",
  "description": "Renders a rasterized SVG thumbnail via image-extractor — the sibling of thumbnail/renderer.json, split out because file-type detects SVG's signature as generic application/xml (confirmed empirically) rather than an image/* MIME, which classifies it binary_category \"other\" rather than \"image\" under this project's existing MIME-category classifier. Same tab name, same underlying extractor as thumbnail — this manifest exists only because of that classification quirk, not because SVG renders any differently once matched.",
  "uid": "2f9ce08d-f069-403a-9375-335e5a8ad4a9",
  "abilities": {
    "selection_type": "single",
    "file_mode": "binary",
    "binary_category": "other",
    "file_type": "svg"
  }
}
